{
  "bpm": 50, "beats": 4, "bars": 16, "key": "F", "scale": "major", "seed": 5, "lufs": -24,
  "reverb": {"decay": 11, "size": 1.8, "damp": 0.4, "predelay": 0.04, "mix": 0.72},
  "delay": {"time": 1.5, "feedback": 0.5, "damp": 0.55, "mix": 0.35},
  "instruments": {
    "warm": { "seconds": 20, "level": 0.42, "layers": [
      {"sine": 1, "harmonics": [[2, 0.25], [3, 0.1]], "attack": 5, "release": 7},
      {"sine": 1.003, "attack": 5.5, "release": 7, "gain": 0.75},
      {"sine": 2.004, "attack": 6, "release": 7, "gain": 0.18} ] },
    "bass": { "seconds": 24, "level": 0.45, "layers": [
      {"sine": 1, "attack": 3, "release": 6},
      {"sine": 2, "attack": 3, "release": 6, "gain": 0.15} ] },
    "chime": { "seconds": 8, "level": 0.3, "layers": [
      {"sine": 1, "decay": 0.8},
      {"sine": 2, "decay": 1.2, "gain": 0.25},
      {"sine": 3.98, "decay": 2.5, "gain": 0.08} ] }
  },
  "tracks": [
    {"inst": "bass", "play": "chords", "chords": "I vi IV V | I iii IV IV | IV I V vi | I V vi IV", "voicing": [1], "every": "4 bars", "octave": 2, "gain": 0.35, "send": 0.5},
    {"inst": "warm", "play": "chords", "chords": "I vi IV V | I iii IV IV | IV I V vi | I V vi IV", "voicing": [1, 3, 5, 7], "strum": 0.25, "every": "4 bars", "octave": 3, "gain": 0.5, "send": 0.8},
    {"inst": "chime", "play": "walk", "every": 0.5, "density": 0.14, "range": [5, 15], "leap": 2, "octave": 5, "pan": "spread", "gain": 0.85, "vel": [0.3, 0.85]},
    {"inst": "chime", "play": "pattern", "pattern": "x... ..x. .... x...", "notes": "8 10 12 9", "octave": 5, "pan": 0.4, "gain": 0.45, "vel": [0.3, 0.6], "from": 9}
  ]
}
