{
  "bpm": 88, "beats": 4, "bars": 16, "key": "G", "scale": "major", "seed": 21, "lufs": -24,
  "reverb": { "decay": 4.5, "size": 1.2, "damp": 0.4, "predelay": 0.02, "mix": 0.4 },
  "delay": { "time": 0.34, "feedback": 0.32, "damp": 0.5, "mix": 0.18 },
  "instruments": {
    "harp": { "seconds": 4, "level": 0.42, "layers": [
      { "sine": 1, "harmonics": [[2, 0.3], [3, 0.12], [4, 0.05]], "decay": 1.9 },
      { "sine": 2, "decay": 4, "gain": 0.15 } ] },
    "bells": { "seconds": 5, "level": 0.32, "layers": [
      { "sine": 1, "decay": 1.4 },
      { "sine": 2.76, "decay": 2.6, "gain": 0.2 },
      { "sine": 5.4, "decay": 4, "gain": 0.07 } ] },
    "pad": { "seconds": 10, "level": 0.38, "layers": [
      { "sine": 1, "harmonics": [[2, 0.2], [3, 0.08]], "attack": 1.2, "release": 2 },
      { "sine": 1.006, "attack": 1.4, "release": 2, "gain": 0.6 } ] },
    "bass": { "seconds": 3, "level": 0.45, "layers": [
      { "sine": 1, "harmonics": [[2, 0.25]], "attack": 0.02, "decay": 1.6 } ] }
  },
  "tracks": [
    { "inst": "pad", "play": "chords", "chords": "I IV vi V", "voicing": [1, 3, 5], "every": "1 bar", "octave": 4, "gain": 0.35, "send": 0.5 },
    { "inst": "harp", "play": "chords", "chords": "I IV vi V", "voicing": [1, 3, 5, 8, 10, 12], "every": "1 bar", "strum": 0.25, "octave": 3, "gain": 0.6, "vel": [0.5, 0.8], "send": 0.5, "pan": -0.2 },
    { "inst": "bass", "play": "pattern", "pattern": "x...x.x.", "notes": "1 1 5  4 4 1  6 6 3  5 5 2", "octave": 2, "gain": 0.45, "vel": [0.6, 0.85], "send": 0.2, "from": 3 },
    { "inst": "bells", "play": "pattern", "pattern": "x.x.x...x.x.x...", "octave": 5, "gain": 0.6, "vel": [0.45, 0.8], "send": 0.6, "pan": 0.25, "from": 5,
      "notes": "5 6 8 8 6 5  4 6 8 10 8 6  3 5 6 8 6 5  2 5 7 9 7 5  8 10 12 10 8 6  8 9 11 13 11 9  6 8 10 12 10 8  9 8 7 5 2 2" },
    { "inst": "bells", "play": "walk", "every": "1 beat", "density": 0.18, "range": [10, 16], "leap": 3, "octave": 5, "pan": "spread", "gain": 0.4, "vel": [0.25, 0.5], "send": 0.8, "from": 9 }
  ]
}
