{
  "bpm": 54, "beats": 4, "bars": 8, "key": "A", "scale": "minor_pentatonic", "seed": 5237, "lufs": -24,
  "reverb": { "decay": 5, "size": 1.3, "damp": 0.4, "predelay": 0.03, "mix": 0.5 },
  "delay": { "time": 0.55, "feedback": 0.5, "mix": 0.35 },
  "instruments": {
    "tide": { "seconds": 8, "level": 0.5, "layers": [
      { "sine": 1, "attack": 2, "release": 3 },
      { "sine": 1.5, "attack": 3, "release": 3, "gain": 0.35 } ] },
    "whistle": { "seconds": 2, "level": 0.35, "layers": [
      { "sine": 1, "attack": 0.05, "decay": 2.5 }, { "sine": 2.01, "decay": 5, "gain": 0.2 } ] },
    "drip": { "seconds": 1, "level": 0.4, "layers": [
      { "sine": 1, "decay": 14 }, { "noise": "hp 0.6", "decay": 40, "gain": 0.15 } ] }
  },
  "tracks": [
    { "inst": "tide", "play": "chords", "chords": "i VI iv v", "every": "2 bars", "octave": 2, "gain": 0.9 },
    { "inst": "whistle", "play": "walk", "every": "2 beats", "density": 0.18, "range": [5, 11], "leap": 2, "octave": 5, "pan": "spread", "gain": 0.5, "send": 0.8 },
    { "inst": "drip", "play": "pattern", "pattern": "x... .... ..x. ....", "notes": "1 3 5", "octave": 6, "gain": 0.4 }
  ]
}
