{
  "bpm": 56, "beats": 4, "bars": 16, "key": "A", "scale": "minor", "seed": 8, "lufs": -25,
  "reverb": { "decay": 8.5, "size": 1.6, "damp": 0.5, "predelay": 0.04, "mix": 0.6 },
  "delay": { "time": 0.8, "feedback": 0.4, "damp": 0.65, "mix": 0.2 },
  "instruments": {
    "piano": { "seconds": 7, "level": 0.5, "layers": [
      { "sine": 1, "harmonics": [[2, 0.38], [3, 0.14], [4, 0.06]], "decay": 0.9 },
      { "sine": 1.0012, "harmonics": [[2, 0.2]], "decay": 0.7, "gain": 0.45 },
      { "sine": 3, "decay": 3, "gain": 0.1 } ] },
    "strings": { "seconds": 14, "level": 0.42, "layers": [
      { "sine": 1, "harmonics": [[2, 0.3], [3, 0.15], [4, 0.06]], "attack": 2.4, "release": 3 },
      { "sine": 1.005, "harmonics": [[2, 0.22]], "attack": 2.7, "release": 3, "gain": 0.6 },
      { "sine": 0.5, "attack": 3, "release": 3, "gain": 0.3 } ] },
    "cello": { "seconds": 9, "level": 0.45, "layers": [
      { "sine": 1, "harmonics": [[2, 0.5], [3, 0.3], [4, 0.17], [5, 0.09]], "attack": 1.1, "release": 2.6 },
      { "sine": 1.006, "harmonics": [[2, 0.35], [3, 0.15]], "attack": 1.3, "release": 2.6, "gain": 0.5 } ] },
    "glass": { "seconds": 5, "level": 0.3, "layers": [
      { "sine": 1, "decay": 2 },
      { "sine": 3.0, "decay": 4.5, "gain": 0.14 },
      { "sine": 4.07, "decay": 6, "gain": 0.06 } ] }
  },
  "tracks": [
    { "inst": "strings", "play": "chords", "chords": "i VI III VII", "voicing": [1, 3, 5, 8], "every": "2 bars", "octave": 3, "gain": 0.55, "send": 0.75 },
    { "inst": "cello", "play": "chords", "chords": "i VI III VII", "voicing": [1], "every": "2 bars", "octave": 2, "gain": 0.5, "send": 0.5, "from": 3 },
    { "inst": "piano", "play": "pattern", "pattern": "x..x..x.", "octave": 4, "gain": 0.75, "vel": [0.5, 0.8], "send": 0.65,
      "notes": "8 7 5 5 3 1  6 8 10 8 6 3  5 7 10 9 7 5  4 7 9 8 7 5  10 9 8 7 5 3  3 6 8 10 8 6  7 10 12 10 9 7  9 8 7 5 4 2" },
    { "inst": "glass", "play": "walk", "every": "2 beats", "density": 0.2, "range": [8, 13], "leap": 2, "octave": 5, "pan": "spread", "gain": 0.6, "vel": [0.3, 0.55], "send": 0.95, "from": 9 }
  ]
}
