{
  "bpm": 50, "beats": 4, "bars": 16, "key": "C#", "scale": "minor", "seed": 90, "lufs": -26,
  "reverb": { "decay": 11, "size": 1.9, "damp": 0.55, "predelay": 0.05, "mix": 0.7 },
  "delay": { "time": 1.2, "feedback": 0.5, "damp": 0.6, "mix": 0.3 },
  "instruments": {
    "piano": { "seconds": 8, "level": 0.5, "layers": [
      { "sine": 1, "harmonics": [[2, 0.36], [3, 0.12], [4, 0.05]], "decay": 0.75 },
      { "sine": 1.0015, "harmonics": [[2, 0.2]], "decay": 0.6, "gain": 0.4 },
      { "sine": 3, "decay": 2.6, "gain": 0.08 } ] },
    "air": { "seconds": 24, "level": 0.38, "layers": [
      { "sine": 1, "attack": 7, "release": 8 },
      { "sine": 1.5, "attack": 8, "release": 8, "gain": 0.18 },
      { "noise": "lp 0.03", "attack": 8, "release": 8, "gain": 0.12 } ] }
  },
  "tracks": [
    { "inst": "air", "play": "chords", "chords": "i VI", "voicing": [1, 5], "every": "8 bars", "octave": 3, "gain": 0.5, "send": 0.7 },
    { "inst": "piano", "play": "pattern", "pattern": "x.......x.......", "octave": 4, "gain": 0.75, "vel": [0.45, 0.75], "send": 0.75, "from": 3, "to": 14,
      "notes": "5 3  2 1  7 5  6 5  3 5  8 7  5 3  2 1  3 2  1 1  5 3  2 7" },
    { "inst": "piano", "play": "walk", "every": "2 beats", "density": 0.13, "range": [8, 15], "leap": 3, "octave": 4, "pan": "spread", "gain": 0.5, "vel": [0.25, 0.5], "send": 0.9 },
    { "inst": "piano", "play": "chords", "chords": "i VI III VII", "voicing": [1, 3, 5], "every": "4 bars", "strum": 0.5, "octave": 3, "gain": 0.35, "vel": [0.3, 0.45], "send": 0.8 }
  ]
}
