{
 "bpm": 76,
 "beats": 4,
 "bars": 16,
 "key": "G",
 "scale": "pentatonic",
 "seed": 404,
 "lufs": -27,
 "reverb": {
  "decay": 4.5,
  "size": 1.1,
  "damp": 0.4,
  "predelay": 0.02,
  "mix": 0.42
 },
 "delay": {
  "time": 0.395,
  "feedback": 0.32,
  "damp": 0.5,
  "mix": 0.18
 },
 "instruments": {
  "piano": {
   "seconds": 6,
   "level": 0.36,
   "layers": [
    {
     "sine": 1,
     "harmonics": [
      [
       2,
       0.25
      ],
      [
       3,
       0.08
      ],
      [
       4,
       0.03
      ]
     ],
     "decay": 1.2,
     "attack": 0.012
    },
    {
     "sine": 1.0015,
     "decay": 2.0,
     "gain": 0.3
    }
   ]
  },
  "pad": {
   "seconds": 12,
   "level": 0.34,
   "layers": [
    {
     "sine": 1,
     "harmonics": [
      [
       2,
       0.18
      ],
      [
       3,
       0.05
      ]
     ],
     "attack": 2.4,
     "release": 4
    },
    {
     "sine": 1.005,
     "attack": 3.0,
     "release": 4,
     "gain": 0.6
    },
    {
     "sine": 0.5,
     "attack": 3.5,
     "release": 4,
     "gain": 0.25
    }
   ]
  },
  "bell": {
   "seconds": 6,
   "level": 0.24,
   "layers": [
    {
     "sine": 1,
     "decay": 1.1
    },
    {
     "sine": 2.76,
     "decay": 2.2,
     "gain": 0.18
    },
    {
     "sine": 5.4,
     "decay": 3.6,
     "gain": 0.06
    }
   ]
  }
 },
 "tracks": [
  {
   "inst": "pad",
   "play": "chords",
   "chords": "I IV I V | I vi IV V",
   "every": "2 bars",
   "octave": 3,
   "gain": 0.26,
   "send": 0.5
  },
  {
   "inst": "piano",
   "play": "pattern",
   "pattern": "x..x..x. ..x.....",
   "notes": [
    1,
    3,
    5,
    6,
    5,
    3,
    2,
    3
   ],
   "every": "1 beat",
   "octave": 4,
   "pan": "spread",
   "gain": 0.6,
   "vel": [
    0.35,
    0.7
   ],
   "send": 0.6
  },
  {
   "inst": "bell",
   "play": "walk",
   "every": "2 beats",
   "density": 0.2,
   "range": [
    6,
    11
   ],
   "octave": 4,
   "pan": "spread",
   "gain": 0.45,
   "send": 0.7,
   "seed": 21,
   "from": 8
  }
 ]
}