{
  "bpm": 72, "beats": 4, "bars": 8, "key": "E", "scale": "phrygian", "seed": 4, "lufs": -24,
  "reverb": { "decay": 5, "size": 1.3, "damp": 0.6, "predelay": 0.02, "mix": 0.5 },
  "delay": { "time": 0.83, "feedback": 0.4, "damp": 0.6, "mix": 0.25 },
  "instruments": {
    "pad": { "seconds": 10, "level": 0.5, "layers": [
      { "sine": 1, "attack": 2, "release": 3 },
      { "sine": 1.006, "attack": 2.5, "release": 3, "gain": 0.7 },
      { "sine": 0.5, "attack": 3, "release": 3, "gain": 0.5 } ] },
    "knock": { "seconds": 1, "level": 0.5, "layers": [
      { "sine": 1, "decay": 9 },
      { "sine": 2.02, "decay": 14, "gain": 0.3 },
      { "noise": "lp 0.15", "decay": 30, "gain": 0.3 } ] },
    "drip": { "seconds": 3, "level": 0.4, "layers": [
      { "sine": 1, "decay": 3 },
      { "sine": 3.01, "decay": 5, "gain": 0.2 } ] }
  },
  "tracks": [
    { "inst": "pad", "play": "chords", "chords": "i II VII i", "every": "2 bars", "octave": 2, "gain": 0.9 },
    { "inst": "knock", "play": "pattern", "pattern": "x.x. x..x x.x. x.x.", "notes": "1 1 5", "octave": 2, "gain": 0.8 },
    { "inst": "drip", "play": "walk", "every": "1 beat", "density": 0.2, "range": [3, 10], "octave": 5, "pan": "spread", "gain": 0.5, "vel": [0.4, 0.8] }
  ]
}
