{
  "bpm": 54, "beats": 4, "bars": 8, "key": "D", "scale": "dorian", "seed": 7166, "lufs": -28,
  "reverb": { "decay": 4, "size": 1.0, "damp": 0.5, "predelay": 0.02, "mix": 0.5 },
  "delay": { "time": 0.55, "feedback": 0.35, "damp": 0.5, "mix": 0.2 },
  "instruments": {
    "pad": { "seconds": 10, "level": 0.5, "layers": [
      { "sine": 1, "attack": 2.5, "release": 4 },
      { "sine": 2.005, "attack": 3, "release": 4, "gain": 0.3 } ] },
    "music_box": { "seconds": 2, "level": 0.4, "layers": [
      { "sine": 1, "decay": 4 },
      { "sine": 3.98, "decay": 8, "gain": 0.25 } ] }
  },
  "tracks": [
    { "inst": "pad", "play": "chords", "chords": "i VII VI VII", "every": "2 bars", "octave": 2, "gain": 0.8, "send": 0.5 },
    { "inst": "music_box", "play": "pattern", "pattern": "x... ..x. .... x...", "notes": "1 3 5 3", "octave": 5, "gain": 0.5, "pan": "spread" }
  ]
}
