{
  "bpm": 52, "beats": 4, "bars": 16, "key": "D", "scale": "phrygian", "seed": 55, "lufs": -25,
  "reverb": { "decay": 10, "size": 1.8, "damp": 0.6, "predelay": 0.05, "mix": 0.6 },
  "delay": { "time": 1.15, "feedback": 0.45, "damp": 0.7, "mix": 0.25 },
  "instruments": {
    "drone": { "seconds": 32, "level": 0.5, "layers": [
      { "sine": 1, "harmonics": [[2, 0.2], [3, 0.1]], "attack": 7, "release": 8 },
      { "sine": 1.007, "attack": 8, "release": 8, "gain": 0.6 },
      { "sine": 0.5, "attack": 8, "release": 8, "gain": 0.4 } ] },
    "pulse": { "seconds": 2, "level": 0.5, "layers": [
      { "sine": 1, "harmonics": [[2, 0.3]], "attack": 0.02, "decay": 3.5 },
      { "noise": "lp 0.04", "decay": 18, "gain": 0.3 } ] },
    "cello": { "seconds": 8, "level": 0.45, "layers": [
      { "sine": 1, "harmonics": [[2, 0.55], [3, 0.35], [4, 0.2], [5, 0.12]], "attack": 1.4, "release": 2.4 },
      { "sine": 1.009, "harmonics": [[2, 0.35]], "attack": 1.6, "release": 2.4, "gain": 0.5 } ] },
    "bell": { "seconds": 9, "level": 0.3, "layers": [
      { "sine": 1, "decay": 0.7 },
      { "sine": 2.76, "decay": 1.2, "gain": 0.3 },
      { "sine": 5.4, "decay": 2, "gain": 0.12 },
      { "sine": 8.93, "decay": 3, "gain": 0.05 } ] }
  },
  "tracks": [
    { "inst": "drone", "play": "chords", "chords": "i", "voicing": [1, 5], "every": "8 bars", "octave": 2, "gain": 0.55, "send": 0.6 },
    { "inst": "pulse", "play": "pattern", "pattern": "x.x.......x.....", "notes": "1 1 2 1 1 7", "octave": 2, "gain": 0.6, "vel": [0.5, 0.8], "send": 0.4 },
    { "inst": "cello", "play": "chords", "chords": "i II i VII", "voicing": [1, 3], "every": "2 bars", "octave": 3, "gain": 0.45, "send": 0.7, "from": 3 },
    { "inst": "cello", "play": "pattern", "pattern": "x.......x...x...", "octave": 3, "gain": 0.5, "vel": [0.5, 0.75], "send": 0.6, "from": 5,
      "notes": "5 6 5  4 3 2  1 2 3  7 6 5  5 6 8  9 8 6  5 4 3  2 1 1" },
    { "inst": "bell", "play": "walk", "every": "2 beats", "density": 0.14, "range": [6, 12], "leap": 4, "octave": 5, "pan": "spread", "gain": 0.6, "vel": [0.3, 0.6], "send": 1, "from": 7 }
  ]
}
