{
  "bpm": 68, "beats": 4, "bars": 16, "key": "D", "scale": "major", "seed": 34, "lufs": -27,
  "reverb": { "decay": 5, "size": 1.2, "damp": 0.5, "predelay": 0.02, "mix": 0.42 },
  "delay": { "time": 0.441, "feedback": 0.38, "damp": 0.6, "mix": 0.22 },
  "instruments": {
    "pad": { "seconds": 10, "level": 0.5, "layers": [
      { "sine": 1,     "attack": 1.6, "release": 3 },
      { "sine": 1.004, "attack": 2,   "release": 3, "gain": 0.7 },
      { "sine": 2,     "attack": 2.5, "release": 3, "gain": 0.2 } ] },
    "kalimba": { "seconds": 3, "level": 0.45, "layers": [
      { "sine": 1,   "decay": 2.8, "attack": 0.004 },
      { "sine": 6.3, "decay": 14,  "gain": 0.16 },
      { "sine": 2,   "decay": 6,   "gain": 0.12 } ] },
    "pluck": { "seconds": 2, "level": 0.42, "layers": [
      { "sine": 1, "harmonics": [[2, 0.35], [3, 0.18], [4, 0.08]], "decay": 4.2, "attack": 0.003 } ] },
    "bass": { "seconds": 4, "level": 0.5, "layers": [
      { "sine": 1, "decay": 1.1, "attack": 0.01 },
      { "sine": 2, "decay": 2.2, "gain": 0.22 } ] }
  },
  "tracks": [
    { "inst": "pad",     "play": "chords", "chords": "I vi IV V", "every": "2 bars", "octave": 3, "gain": 0.45 },
    { "inst": "bass",    "play": "chords", "chords": "I vi IV V", "voicing": [1], "every": "2 bars", "octave": 2, "gain": 0.4 },
    { "inst": "kalimba", "play": "pattern", "pattern": "x..x..x. ..x..x..", "notes": [1, 3, 5, 3, 6, 5, 3, 2], "every": "1 beat", "octave": 4, "pan": "spread", "gain": 1.0, "send": 0.7 },
    { "inst": "pluck",   "play": "walk", "every": "2 beats", "density": 0.3, "range": [3, 11], "octave": 5, "pan": "spread", "gain": 0.8, "vel": [0.45, 0.85], "seed": 3, "from": 4 }
  ]
}
