{
  "bpm": 64, "beats": 4, "bars": 16, "key": "E", "scale": "pentatonic", "seed": 2, "lufs": -24,
  "reverb": {"decay": 9, "size": 1.6, "damp": 0.4, "predelay": 0.03, "mix": 0.65},
  "delay": {"time": 0.75, "feedback": 0.55, "damp": 0.55, "mix": 0.42},
  "instruments": {
    "pad": { "seconds": 18, "level": 0.4, "layers": [
      {"sine": 1, "attack": 5, "release": 6},
      {"sine": 1.005, "attack": 5.5, "release": 6, "gain": 0.75},
      {"sine": 2.002, "attack": 6, "release": 6, "gain": 0.2},
      {"sine": 0.5, "attack": 6, "release": 6, "gain": 0.35} ] },
    "drop": { "seconds": 5, "level": 0.32, "layers": [
      {"sine": 1, "decay": 2.2},
      {"sine": 3.0, "decay": 4.5, "gain": 0.16},
      {"sine": 4.07, "decay": 6, "gain": 0.07} ] },
    "low": { "seconds": 12, "level": 0.45, "layers": [
      {"sine": 1, "attack": 0.4, "decay": 0.25},
      {"sine": 2, "attack": 0.4, "decay": 0.5, "gain": 0.3} ] }
  },
  "tracks": [
    {"inst": "pad", "play": "chords", "chords": "1 6 4 5 | 1 4 6 5 | 6 4 1 5 | 1 5 6 4", "voicing": [1, 3, 5], "every": "4 bars", "octave": 3, "gain": 0.55, "send": 0.8},
    {"inst": "low", "play": "pattern", "pattern": "x... .... x... ..x.", "notes": "1 1 5", "octave": 2, "gain": 0.35, "send": 0.4, "from": 5},
    {"inst": "drop", "play": "pattern", "pattern": "x.x. x..x .x.x x...", "notes": "5 8 10 9 6 8 12 10", "octave": 5, "pan": "spread", "gain": 0.65, "vel": [0.35, 0.8], "send": 0.9},
    {"inst": "drop", "play": "walk", "every": 0.5, "density": 0.18, "range": [6, 16], "leap": 2, "octave": 5, "pan": "spread", "gain": 0.6, "vel": [0.25, 0.7], "seed": 7, "from": 9}
  ]
}
