{
  "bpm": 78, "beats": 3, "bars": 8, "key": "D", "scale": "minor", "seed": 6859, "lufs": -26,
  "reverb": { "decay": 4, "size": 1.3, "damp": 0.5, "predelay": 0.02, "mix": 0.45 },
  "instruments": {
    "bow": { "seconds": 6, "level": 0.5, "layers": [
      { "sine": 1,     "attack": 0.8, "release": 2 },
      { "sine": 1.004, "attack": 0.8, "release": 2, "gain": 0.8 },
      { "sine": 2,     "attack": 1.2, "release": 2, "gain": 0.25 } ] },
    "pluck": { "seconds": 1.5, "level": 0.4, "layers": [
      { "sine": 1,    "decay": 5 },
      { "sine": 3.01, "decay": 9, "gain": 0.2 } ] }
  },
  "tracks": [
    { "inst": "bow", "play": "chords", "chords": "i VI iv V", "voicing": [1], "every": "1 bars", "octave": 2, "gain": 0.9, "send": 0.5 },
    { "inst": "pluck", "play": "pattern", "pattern": "x.. x.x x.. ..x", "notes": "1 3 5 3", "octave": 4, "gain": 0.5, "pan": "spread" }
  ]
}
