{
 "bpm": 64,
 "beats": 4,
 "bars": 16,
 "key": "D",
 "scale": "major",
 "seed": 101,
 "lufs": -27,
 "reverb": {
  "decay": 6,
  "size": 1.3,
  "damp": 0.5,
  "predelay": 0.03,
  "mix": 0.5
 },
 "delay": {
  "time": 0.47,
  "feedback": 0.3,
  "damp": 0.6,
  "mix": 0.14
 },
 "instruments": {
  "piano": {
   "seconds": 5,
   "level": 0.42,
   "layers": [
    {
     "sine": 1,
     "harmonics": [
      [
       2,
       0.38
      ],
      [
       3,
       0.14
      ],
      [
       4,
       0.06
      ],
      [
       5,
       0.025
      ]
     ],
     "decay": 1.7,
     "attack": 0.004
    },
    {
     "sine": 1.0018,
     "decay": 2.6,
     "gain": 0.28
    },
    {
     "sine": 0.5,
     "decay": 3.2,
     "gain": 0.08
    }
   ]
  },
  "pad": {
   "seconds": 12,
   "level": 0.34,
   "layers": [
    {
     "sine": 1,
     "harmonics": [
      [
       2,
       0.18
      ],
      [
       3,
       0.05
      ]
     ],
     "attack": 2.4,
     "release": 4
    },
    {
     "sine": 1.005,
     "attack": 3.0,
     "release": 4,
     "gain": 0.6
    },
    {
     "sine": 0.5,
     "attack": 3.5,
     "release": 4,
     "gain": 0.25
    }
   ]
  },
  "low": {
   "seconds": 5,
   "level": 0.4,
   "layers": [
    {
     "sine": 1,
     "harmonics": [
      [
       2,
       0.2
      ]
     ],
     "decay": 1.0,
     "attack": 0.01
    }
   ]
  }
 },
 "tracks": [
  {
   "inst": "pad",
   "play": "chords",
   "chords": "I vi IV I | I iii IV V",
   "every": "2 bars",
   "octave": 3,
   "gain": 0.3,
   "send": 0.6
  },
  {
   "inst": "low",
   "play": "chords",
   "chords": "I vi IV I | I iii IV V",
   "voicing": [
    1
   ],
   "every": "2 bars",
   "octave": 2,
   "gain": 0.32
  },
  {
   "inst": "piano",
   "play": "chords",
   "chords": "I vi IV I | I iii IV V",
   "voicing": [
    1,
    5,
    8,
    10
   ],
   "every": "2 bars",
   "strum": 0.35,
   "octave": 3,
   "gain": 0.45,
   "vel": [
    0.4,
    0.65
   ],
   "send": 0.6
  },
  {
   "inst": "piano",
   "play": "walk",
   "every": "1 beat",
   "density": 0.22,
   "range": [
    5,
    12
   ],
   "leap": 2,
   "octave": 4,
   "pan": "spread",
   "gain": 0.7,
   "vel": [
    0.35,
    0.75
   ],
   "send": 0.7,
   "seed": 5,
   "from": 3,
   "to": 15
  }
 ]
}