{
  "bpm": 54, "beats": 4, "bars": 16, "key": "G", "scale": "major", "seed": 21, "lufs": -27,
  "reverb": { "decay": 6.5, "size": 1.3, "damp": 0.45, "predelay": 0.025, "mix": 0.55 },
  "delay": { "time": 0.555, "feedback": 0.4, "damp": 0.55, "mix": 0.28 },
  "instruments": {
    "pad": { "seconds": 14, "level": 0.5, "layers": [
      { "sine": 1,     "attack": 2.5, "release": 4 },
      { "sine": 1.003, "attack": 3,   "release": 4, "gain": 0.7 },
      { "sine": 2,     "attack": 4,   "release": 4, "gain": 0.22 },
      { "sine": 3.01,  "attack": 5,   "release": 4, "gain": 0.07 } ] },
    "glass": { "seconds": 6, "level": 0.42, "layers": [
      { "sine": 1,    "decay": 1.0 },
      { "sine": 2.76, "decay": 1.7, "gain": 0.2 },
      { "sine": 5.4,  "decay": 3.2, "gain": 0.07 } ] },
    "kalimba": { "seconds": 3, "level": 0.42, "layers": [
      { "sine": 1,   "decay": 2.6, "attack": 0.004 },
      { "sine": 6.3, "decay": 14,  "gain": 0.16 },
      { "sine": 2,   "decay": 6,   "gain": 0.12 } ] },
    "drone": { "seconds": 40, "level": 0.5, "layers": [
      { "sine": 1,    "attack": 8, "release": 8 },
      { "sine": 1.5,  "attack": 10, "release": 8, "gain": 0.18 },
      { "sine": 2.01, "attack": 8, "release": 8, "gain": 0.16 } ] }
  },
  "tracks": [
    { "inst": "drone",   "play": "chords", "chords": "1", "voicing": [1], "every": "8 bars", "octave": 2, "gain": 0.3, "send": 0.5 },
    { "inst": "pad",     "play": "chords", "chords": "I V vi IV", "every": "2 bars", "octave": 3, "gain": 0.55 },
    { "inst": "glass",   "play": "walk", "every": "1 beat",  "density": 0.26, "range": [5, 12], "octave": 5, "pan": "spread", "gain": 1.0, "vel": [0.5, 0.9] },
    { "inst": "kalimba", "play": "walk", "every": "1 beat",  "density": 0.34, "range": [1, 9],  "octave": 4, "pan": "spread", "gain": 0.9,  "vel": [0.4, 0.85], "seed": 8, "from": 4 }
  ]
}
